[
  {
    "certification": {
      "evidence": [
        "metadata-schema",
        "environment-probe-contract",
        "input-contract",
        "argv-command-plan",
        "conservative-parser-policy"
      ],
      "evidence_scope": "repository-fixture-only",
      "fixture_hashes": [],
      "last_verified": "2026-07-24",
      "level": "A3",
      "limitations": [
        "No live third-party solver execution is claimed by this certification.",
        "Adapter presence does not establish solver availability or model applicability.",
        "Generic positional-input commands are disabled; this adapter needs an engine-specific execution implementation."
      ],
      "live_solver_execution": false,
      "solver_versions": [],
      "verified_platforms": [
        "repository-ci-contract-fixtures"
      ]
    },
    "executables": [
      "g16",
      "g09"
    ],
    "license_kind": "commercial",
    "live_execution_verified": false,
    "maturity": "A3",
    "name": "Gaussian",
    "parser_policy": "Conservative: unknown or incomplete output is not promoted to converged or validated.",
    "runnable_when": "Planning and environment probe only: no engine-specific command protocol is implemented in Adapter.build_command.",
    "slug": "gaussian",
    "workflow": "quantum-chemistry"
  },
  {
    "certification": {
      "evidence": [
        "metadata-schema",
        "environment-probe-contract",
        "input-contract",
        "argv-command-plan",
        "conservative-parser-policy",
        "deterministic-success-and-failure-fixtures",
        "numerical-and-physical-validation-gates"
      ],
      "evidence_scope": "repository-fixture-only",
      "fixture_hashes": [],
      "last_verified": "2026-07-24",
      "level": "A4",
      "limitations": [
        "No live third-party solver execution is claimed by this certification.",
        "Adapter presence does not establish solver availability or model applicability."
      ],
      "live_solver_execution": false,
      "solver_versions": [],
      "verified_platforms": [
        "repository-ci-contract-fixtures"
      ]
    },
    "executables": [
      "orca"
    ],
    "license_kind": "external",
    "live_execution_verified": false,
    "maturity": "A4",
    "name": "ORCA",
    "parser_policy": "Conservative: unknown or incomplete output is not promoted to converged or validated.",
    "runnable_when": "Implemented engine argv protocol, declared executable, required inputs, environment and license checks must pass; hash-bound execution authorization is still required.",
    "slug": "orca",
    "workflow": "quantum-chemistry"
  },
  {
    "certification": {
      "evidence": [
        "metadata-schema",
        "environment-probe-contract",
        "input-contract",
        "argv-command-plan",
        "conservative-parser-policy",
        "deterministic-success-and-failure-fixtures",
        "numerical-and-physical-validation-gates"
      ],
      "evidence_scope": "repository-fixture-only",
      "fixture_hashes": [],
      "last_verified": "2026-07-24",
      "level": "A4",
      "limitations": [
        "No live third-party solver execution is claimed by this certification.",
        "Adapter presence does not establish solver availability or model applicability.",
        "Generic positional-input commands are disabled; this adapter needs an engine-specific execution implementation."
      ],
      "live_solver_execution": false,
      "solver_versions": [],
      "verified_platforms": [
        "repository-ci-contract-fixtures"
      ]
    },
    "executables": [
      "psi4"
    ],
    "license_kind": "open-source",
    "live_execution_verified": false,
    "maturity": "A4",
    "name": "Psi4",
    "parser_policy": "Conservative: unknown or incomplete output is not promoted to converged or validated.",
    "runnable_when": "Planning and environment probe only: no engine-specific command protocol is implemented in Adapter.build_command.",
    "slug": "psi4",
    "workflow": "quantum-chemistry"
  },
  {
    "certification": {
      "evidence": [
        "metadata-schema",
        "environment-probe-contract",
        "input-contract",
        "argv-command-plan",
        "conservative-parser-policy",
        "deterministic-success-and-failure-fixtures",
        "numerical-and-physical-validation-gates"
      ],
      "evidence_scope": "repository-fixture-only",
      "fixture_hashes": [],
      "last_verified": "2026-07-24",
      "level": "A4",
      "limitations": [
        "No live third-party solver execution is claimed by this certification.",
        "Adapter presence does not establish solver availability or model applicability."
      ],
      "live_solver_execution": false,
      "solver_versions": [],
      "verified_platforms": [
        "repository-ci-contract-fixtures"
      ]
    },
    "executables": [
      "python"
    ],
    "license_kind": "open-source",
    "live_execution_verified": false,
    "maturity": "A4",
    "name": "PySCF",
    "parser_policy": "Conservative: unknown or incomplete output is not promoted to converged or validated.",
    "python_modules": [
      "pyscf"
    ],
    "runnable_when": "A .py driver, declared Python interpreter, all declared modules and environment checks are required; hash-bound execution authorization is still required.",
    "slug": "pyscf",
    "workflow": "quantum-chemistry"
  },
  {
    "certification": {
      "evidence": [
        "metadata-schema",
        "environment-probe-contract",
        "input-contract",
        "argv-command-plan",
        "conservative-parser-policy",
        "deterministic-success-and-failure-fixtures",
        "numerical-and-physical-validation-gates"
      ],
      "evidence_scope": "repository-fixture-only",
      "fixture_hashes": [],
      "last_verified": "2026-07-24",
      "level": "A4",
      "limitations": [
        "No live third-party solver execution is claimed by this certification.",
        "Adapter presence does not establish solver availability or model applicability."
      ],
      "live_solver_execution": false,
      "solver_versions": [],
      "verified_platforms": [
        "repository-ci-contract-fixtures"
      ]
    },
    "executables": [
      "pw.x"
    ],
    "license_kind": "open-source",
    "live_execution_verified": false,
    "maturity": "A4",
    "name": "Quantum ESPRESSO",
    "parser_policy": "Conservative: unknown or incomplete output is not promoted to converged or validated.",
    "runnable_when": "Implemented engine argv protocol, declared executable, required inputs, environment and license checks must pass; hash-bound execution authorization is still required.",
    "slug": "quantum-espresso",
    "workflow": "periodic-dft"
  },
  {
    "certification": {
      "evidence": [
        "metadata-schema",
        "environment-probe-contract",
        "input-contract",
        "argv-command-plan",
        "conservative-parser-policy",
        "deterministic-success-and-failure-fixtures",
        "numerical-and-physical-validation-gates"
      ],
      "evidence_scope": "repository-fixture-only",
      "fixture_hashes": [],
      "last_verified": "2026-07-24",
      "level": "A4",
      "limitations": [
        "No live third-party solver execution is claimed by this certification.",
        "Adapter presence does not establish solver availability or model applicability.",
        "Generic positional-input commands are disabled; this adapter needs an engine-specific execution implementation."
      ],
      "live_solver_execution": false,
      "solver_versions": [],
      "verified_platforms": [
        "repository-ci-contract-fixtures"
      ]
    },
    "executables": [
      "cp2k"
    ],
    "license_kind": "open-source",
    "live_execution_verified": false,
    "maturity": "A4",
    "name": "CP2K",
    "parser_policy": "Conservative: unknown or incomplete output is not promoted to converged or validated.",
    "runnable_when": "Planning and environment probe only: no engine-specific command protocol is implemented in Adapter.build_command.",
    "slug": "cp2k",
    "workflow": "periodic-dft"
  },
  {
    "certification": {
      "evidence": [
        "metadata-schema",
        "environment-probe-contract",
        "input-contract",
        "argv-command-plan",
        "conservative-parser-policy"
      ],
      "evidence_scope": "repository-fixture-only",
      "fixture_hashes": [],
      "last_verified": "2026-07-24",
      "level": "A3",
      "limitations": [
        "No live third-party solver execution is claimed by this certification.",
        "Adapter presence does not establish solver availability or model applicability.",
        "Generic positional-input commands are disabled; this adapter needs an engine-specific execution implementation."
      ],
      "live_solver_execution": false,
      "solver_versions": [],
      "verified_platforms": [
        "repository-ci-contract-fixtures"
      ]
    },
    "executables": [
      "vasp_std"
    ],
    "license_kind": "commercial",
    "live_execution_verified": false,
    "maturity": "A3",
    "name": "VASP",
    "parser_policy": "Conservative: unknown or incomplete output is not promoted to converged or validated.",
    "runnable_when": "Planning and environment probe only: no engine-specific command protocol is implemented in Adapter.build_command.",
    "slug": "vasp",
    "workflow": "periodic-dft"
  },
  {
    "certification": {
      "evidence": [
        "metadata-schema",
        "environment-probe-contract",
        "input-contract",
        "argv-command-plan",
        "conservative-parser-policy"
      ],
      "evidence_scope": "repository-fixture-only",
      "fixture_hashes": [],
      "last_verified": "2026-07-24",
      "level": "A3",
      "limitations": [
        "No live third-party solver execution is claimed by this certification.",